name,Description
Peach Poly Crepe jumpsuit,"This stylish foil print kurta from janasya is made of poly crepe and comes in an attractive peach color. It features 3/4 sleeve,round neck,a-line and it is calf length kurta that is suitable for casual occasions. Team it with matching leggings for a chic look."
Light Brown Bias Yoke Checks Top,"This check pattern top by Work Label is crafted in cotton. Featuring a bias check at the yoke and straight check pattern in bottom half, a smart round Neckline, 3/4th sleeves, this mid hip length top offers a stylish & comfortable fit. Style this top with a trouser/skirt and medium high heels for chic look at work. This top can also be styled with a pair of stud earrings and a pair your regular sneakers to attain a casual look."
Off White Geometric Straight Cotton Dobby Top With Skirt (Set of 2),"Featuring elegant printed details, this off white top and skirt set from Jaipur Kurti makes a statement addition to your casual wardrobe. Style this set with a pair of high heels and statement accessories to complete the look."
Blue Me Away Cape Top,"Add an extra dose of style to your casual wardrobe with this elegant blue cape top from Twenty Dresses. Style With: A pair of black denims, colour block heels and statement earrings will complete this look!"
Yellow On A High Gown,Yellow polyester georgette maxi dress. Polyester knit lining inside for comfort. Overlapping v neckline with gathers at bust. Flared sleeves with attached belt at the waist. Concealed zipper on the left.
White Logo Round Neck T-Shirt,No well-edited closet is complete without a printed T-shirt like this one from GAP. It's cut for a close fit from soft jersey with touches of cotton-blend. Style yours with washed denim or layered under a chunky knit.
Yellow Sandy Maxi Dress,"We are excited to announce our long awaited launch of contemporary clothing in Indian hand block & hand painted textiles, and we are thrilled to have a fresh new look. Please note: This piece is handmade with love and care by various artisans and therefore slight differences of design and colour may occur from piece-to-piece which allows for a signature one-of-a-kind aesthetic."
Indigo Prairie Denim Midi Dress,Pleated jacket fastened with cotton pleated drawstring and coconut wood buttons made in natural indigo dyed Handloom khadi denim fabric
Off White Gilet Top,Off-white gilet front open top featuring circular mirrors on yoke.
Black Stripe All The Way Jumpsuit,Black stripe printed polyester twill crepe jumpsuit.. Overlapping wrap style neckline and sleeveless style.. Back zipper for closure and a separate belt for style.. Straight legged bottoms with pockets on both sides for style and comfort..
Grey Floral Print Lace Insert T-Shirt,"Aeropostale's tee is made from blended cotton fabric and has a comfortable fit. It features a round neck, long sleeves and an all-over floral print for a classy look and feel. Wear yours with everything from distressed jeans to equally bold mini skirts."
White Patterned Lana Shirt,Twisted overlapping panel shirt
Black Stripes Got Me Wrapped Dress,Black Stripes Polyester Twill Crepe wrap dress. Sleeveless with v-neckline sheath dress. A functional button on the inside and a button on the front for closure.
Multi-Color Turn Over A New Leaf Top,Multicolor leaf printed polyester crepe top. High collar neckline with tie-up. Regular full length sleeves with cuff attachment at sleeve hemline.
Purple Lace Panel Woven Top,"When it comes to tops, their build and details strike a perfect cord of balance. This piece from Aeropostale is made from a fabric that feels soft against the skin. Wear yours over the weekend with everything from jeans to culottes."
Pink The Classic Ruffled Top,A pink full sleeves ruffled top with with bow tie detailing around neckline.
Blue The Peplum Plush Top,Blue multicolor floral printed georgette peplum top. Wrap style overlapping v-neckline. Full length sheer balloon sleeves with smocked cuff. Smocked waist band. Polyester knit lining inside for comfort.
White Long Flared Dress,"This off white long dress by Baise Gaba is crafted in georgette and cotton, flared and features single straps, lace details in the front, regular fit and tie up knot at the back. Team this dress with danglers and a charm bracelet to create a trendy look."
Purple Draped Jumpsuit,"Accentuate your wardrobe with this lilac draped jumpsuit by Tarun Tahiliani. Crafted in foil crinkle tulle, pick this jumpsuit for your next festivity. Style it with statement jewellery and high heels to complete the look."
Teal Accomplish Ajrakh Shirt,"A smart navy blue collared shirt by Okhai features wooden buttons, crafted from airy cotton fabric and hand block printed with ajrakh motifs. The jigsaw panelling makes it a unique design that can be styled as both formal or casual. Wear it with high waisted skirts or pants, over palazzos, jeans or shorts, or even with dungarees."
Olive Casual Regular Sleeve Printed Top,Add a fresh and vibrant touch to your casual wardrobe with this Top from Campus Sutra. Team it with a pair of jeans and flip-flops or shoe for a cool look.
Yellow Drawstring Waist Flared Floral Dress,Peplum Yellow Drawstring Waist Flared Floral Dress
Multicolor Geometric Print Dress,"This multicolor geometric print dress by Bunaai is crafted in cotton and features a high neck, balloon sleeves, maxi length and a comfortable fit. Style this dress with a pair of sneakers to complete the look. Buy this dress online. Please note: This piece is handmade with love and care by various artisans and therefore slight differences of design and colour may occur from piece-to-piece which allows for a signature one-of-a-kind aesthetic."
Navy Blue The Polka Playful Midi Dress,Navy blue polka rayon midi dress. Fit and flare silhouette. V neck with front ruching. Adjustable shoulder strap with ruffle detailing. Smocking at the back for fit and ease.
Pink Crew Neck Graphic T-Shirt,"Crew neck , Short sleeves , Logo graphic at front ,,,,,"
Black Slipping Into Polka Midi Dress,Black polka printed polyester georgette midi dress. Fit and flare silhouette. Smocked yoke with wide square neckline for style and comfort. Smocking at sleeves and ruffle at sleeve hem. Slit at front for style.
Mustard Halter Neck Top,"An all purpose piece. Can be teamed up with any jeans, skirt or pants. Definitely makes you stand apart. Accessories will add to the compliments"
Grey Glitter Logo Pullover Sweatshirt,"Made from a soft cotton-blend jersey, this sweatshirt by GAP will be your go-to number when the temperature drops. The glitter logo at front adds a signature appeal, while a crew neck, long sleeves and ribbed trims complete its design. Throw yours with a tee and jeans on off-duty days."
Pink You Smock Me Up Crop Top,Pink polyester georgette crop top. V neckline with fabric buttons on the center front. Smocked waist band with frill detailing at hemline. Full length bishop sleeves with elastic at sleeve hem.
Rust Sweetheart In Polka Dress,Rust polka printed polyester moss crepe dress. Sweetheart neckline with puff sleeves. Fit and flare silhouette. Ruffled bottom. Centre back zipper for closure.
Yellow Meet The Blooms Gown,Yellow Polyester Georgette Floral Printed Gown. Polyester Knit Lining Inside for comfort. Halter neck & deep incut Sleeveless dress. Elasticated Waistline blouson style with a tie up for style. Keyhole button on the back for fastening.
Blaze In Red Playsuit,Red polyester knit wrap style playsuit. Sleeveless with a lapel collar neckline. Blazer inspired wrap silhouette. Mock button pockets for style. Center back zipper for fastening and ease.
Black Sequin Logo Round Neck T-Shirt,"GAP is known for producing good quality casuals, and this sequin-embellished tee hits the cord. It's cut from breathable cotton jersey and has a round neck and short sleeves. Wear yours with linen shorts for an effortless feel."
Yellow Optimist Hand Embroidered Midi Dress,"A vibrant yellow dress  by Okhai to light up your wardrobe and lift your mood. With a fabric belt to cinch the waist, hand embroidered real mirrors for sparkle and subtle blanket stitch, this cheerful design is for the optimist in you. Wear it for destination day weddings, brunch meetups or quality solo time at your favourite cafe."
Maroon Slit On My Mind Co-ordinates,Maroon polka printed polyester moss crepe skirt co-ord set. Crop top with adjustable straps and smocking detailing at the back. A line midi skirt with thigh high slit. Fabric buttons above the slit for style. Side zip closure on the skirt.
Maroon Ready For The Royal Ball Gown,Maroon polyester georgette with polyester crepe lining maxi dress. Gathers around the waist and shoulders with tie up detailing at the shoulder for style. Fit and flare silhouette. Sleeveless with overlapping v-neckline. Concealed side zipper for fastening and ease.
Pink Ready For The Royals Maxi Dress,"Steal the show wearing this pink maxi dress from Twenty Dresses. Style With: A pair of high heels, a statement clutch with subtle accessories will complete this stunning evening look!"
White Buti Printed Top,A white buti printed top make it an extra-special summer essential. This top can be paired with uneven hem pant.
Maroon Show Me Off Dress,A maroon kniited dress having a fit and flare silhouette along with net detailing at the neck yoke and waist for style. It is short sleeved with back button for fastening and ease.
Black V-Neck Top,"This black top from Vero Moda is crafted from viscose and rayon and features a V-neck with button placket,3/4th sleeves and curved hemline. Buy this top online and style it with trousers and heels for a formal look."
Olive Wrapped In Style Floral Top,Olive floral printed rayon wrap top. Wrap style overlapping v-neckline. Frill detailing at neckline. Peplum waist cut. Three fourth balloon sleeves with elastic at the sleeve hem. Attached belt tie up for closure and ease.
Pink All About That Lace Gown,Pink polyester georgette and lace maxi dress with polyester knit lining. Lace detailing on the front and back yoke. Sleeveless with v neckline. Fit & flare silhouette. Side zipper for fastening & ease
Blue Take Me Up A Notch Gown,Blue polyester georgette maxi dress. Polyester knit lining inside for comfort. Adjustable shoulder straps with a v neckline. Buttons at centre back for style. Concealed zipper on the left.
Blue Short Sleeves Printed Top,"Make a stunning style statement with this elegant blue top from GAP. Crafted in rayon, style this top with a pair of girlfriend denims and high heels to complete the ensemble."
Sea Green Solid Straight Cotton Slub Shirt,"This green shirt is meant for the fashion-forward women. Pair it with straight pants, heels and fine accessories to complete the look."
Olive Hung Up On You Floral Dress,Green floral printed rayon dress. Overlapping v-neckline. Smocked band at the waist for style and comfort. Full sleeves with gathers at the top and elasticated at the wrist. Floral dresses create an effortless all in one outfit and can easily transition from day to night!. Accessorize with: tie up flats and a cute crossbody bag will complete this casual chic look!
Off White Groovy Art Dress,A lovely off white hued printed dress that is perfect for a summer brunch look. The options are many you can wear it as a one piece or go for leggings if you want to give it a traditional touch.
Fuchsia Floral Print Lace Up Front Top,"This off-shoulder top from Aeropostale is an effortless choice for weekends. Cut from a soft cotton, it's finished with a lace-up front and floral prints all over. Wear yours with skinny jeans and low-top sneakers."
Blue Floral Design Casual Top,Add a fresh and vibrant touch to your casual wardrobe with this Top from Campus Sutra. Team it with a pair of Jeans or Shorts and flip-flops or shoe for a cool look.
Black Floral My Sweetheart Dress,Black floral printed rayon crepe dress. Fit and flare silhouette. Smocked band at the waist for style and comfort. Ruffles at hem for style. Three fourth sleeves with a v neckline.
Yellow Floral Vibrance Dress,Yellow Floral Rayon Dress with Voile Lining inside. Shoulder Straps with tie up at waist. Fit & Flare with ruffles at hem. Side Zipper for fastening & ease.
Casual Beige Cotton Top,"This beige lace top from ONLY is crafted in cotton and features a round neck with tie-up details on the front,short sleeves and scalloped hemline. Buy this top online and pair it with jeans and nude heels to complete the look."
Black Solid Boat Neck Mini Dress,"GAP's dress is cut from smooth satin in a flattering fit and flare silhouette. Even better, this piece comes with pockets on the sides, while the slight gathers at the waist add fullness. Wear it for an evening out with strappy sandals."
Maxi Navy Blue Polka Dot Dress,Peplum Maxi Navy Blue Polka Dot Dress
Pink Front Tie Shirt,"This pink shirt by Torqadorn is crafted in satin and features a collared neck, button closure on the front, long sleeves, a tie-up detail on the front and a relaxed fit. Buy this shirt online and pair it with flared pants and heels to create a statement look."
Peach Ellery Frill Maxi Dress,"Bring the romance in this dreamy peach floral maxi dress. It’s elevated with soft ruffles and flutter sleeves, so wear yours with subtle accessories and low strappy heels to let the details shine."
SAMSHEK Blue A-Line Ruffle Dress,"A casual wear A-line  blue dress with V neckline and ruffles on the sleeves 
<br>
<br>Color: Light Blue 
<br>Neck: V Neck 
<br>Sleeves: 3/4th Bell Sleeves 
<br>Length: Knee Length 
<br>Fit: Regular Fit
<br>Fabric: Georgette 
<br>Fabric Composition: Viscose
<br>Style: Casual"
Black Bow To Ruffle Short Dress,"Crafted in textured satin with a polyester knit lining, this dress flatters those who are bottom heavy. It features a v-neckline, ruffles from waist to hem, a fabric belt and a concealed zipper with a hook button at the back. Style with: High-shine heels, an envelope clutch and minimal accessories. The model (height 5'6"") is wearing a size XS"
Navy Blue Clapton Collared Dress,"This navy blue pleated dress from Payal Pratap will be a great addition to your western wear collection. Featuring a collar neck and 3/4th sleeves, pair this dress with silver accessories and casual footwear to create that go-to look."
Black Welcome To The Party Jumpsuit,Black polyester knit jumpsuit. Round neckline with deep incuts. Back zipper for closure.
Pink Plush In Pleats Playsuit,Pink pleated velvet playsuit. Overlapping v neckline with fitted full sleeves. Straight legged short bottoms. Concealed centre back zipper for fastening and ease.
Uzbek Velvet Low Crotch Jumpsuit,"Revamp your wardrobe with this jumpsuit by Payal Singhal. Crafted in velvet, it features embroidery and has low crotch. Style it with statement jewellery and embellished footwear to ace the outfit."
Short Black Faux Leather Jacket,"This black short jacket from Vero Moda is crafted from polyester and features a lapel collar neck with zip and button fastening, long sleeves and side pockets. Buy this jacket online and style it with dress or skinny jeans and boots to make a statement."
Yellow Printed Crop T-Shirt,"This yellow t-shirt by Only is crafted in viscose and features a round neck, short sleeves, graphic print details and a regular fit. Style this t-shirt with a pair of denim shorts and casual sneakers to complete the look. Buy this t-shirt online."
Black Count On Me Jumpsuit,Inspire chic finesse in your line-up with this black jumpsuit from Twenty Dresses. Style With: A pair of block mules and a chic handbag will complete this stunning look!
Beige Textured Pullover,"This beige pullover by Only is crafted in polyester and features a round neck, long sleeves and a regular fit. Buy this pullover online and style it with a pair of skinny jeans and casual sneakers to complete the look."
SAMSHEK Sea Green One Shoulder Top,"A casual wear viscose one shoulder top with asymmetric hem 
<br>
<br>Color: Sea Green 
<br>Neck: Asymmetric 
<br>Sleeves: 3/4th One Side Sleeve 
<br>Length: Low Waist 
<br>Fit: Regular Fit 
<br>Fabric: Georgette
<br>Fabric Composition: 100% Viscose
<br>Style: Casual"
White Bodycon Lace Dress,Cotton Lace Dress with a Cut-out Back
Red Check Buttoned Top,"This red crepe check buttoned-down top features a mandarin neck, 3/4th sleeves and asymmetrical sides. This top has a regular fit. Style this top with stud earrings, jeggings and heels. Buy this dress online."
Maroon Edging Towards Style Dress,Maroon polyester knit dress. One shoulder neckline. Fit and flare silhouette.
Maroon Neck Tie Shirt,"This maroon shirt by Torqadorn is crafted in crepe and features a tie-up detail on the neck, button closure on the front, long sleeves and a relaxed fit. Buy this shirt online and pair it with straight pants and heels to create a statement look."
Navy Blue Logo Round Neck T-Shirt,This elegant blue t-shirt by GAP is crafted in cotton and is a must-have in your casual collection. Style this t-shirt with a pair of boyfriend denims and your regular sneakers to complete the look.
Black Willow Printed Midi Dress,"Printed in timeless black and white spots, this midi dress has a square neckline and feminine puff sleeves. Perfect for everyday wear, style this on-trend piece with chunky sneakers or nude sandals."
Light Brown Solid A-Line Viscose Top,Make a stunning style statement with this elegant light brown top from Jaipur Kurti. Team this top with a pair of boyfriend denims and block heels to complete the look.
Black Tassel Dress,This black solid cotton dress is by Ambraee. The colour of the garment may differ from the picture.
Pink Floral Print Flutter Sleeve Top,"Split-V mandarin neck , Flutter sleeves , All over floral print ,,,,,"
Indigo Roza Denim Jumpsuit,Jumpsuit with cross front neck and fringe details in natural indigo dyed handloom khadi denim fastened with natural coconut buttons and knot at the back
Pink Belt It Out Maxi Dress,Pink polyester georgette maxi dress. Polyester knit lining inside for comfort. Adjustable shoulder straps with a square neckline. Cut out at the back with a broad tie up belt for style. Thigh high slit for style. Concealed zipper on the left. Classic and chic this gorgeous gown will make you feel every bit beautiful and be perfect for a cocktail night!. Accessorize with: kitten heels and a cute clutch will be all you need!
Blue Hold It High Denim Jumpsuit,Blue cotton denim jumpsuit. Sleeveless with a v neckline. Straight leg silhouette with side pockets. Center front button placket for fastening and ease.
Yellow Arrow Top,"An all purpose piece. Can be teamed up with any jeans, skirt or pants. Definitely makes you stand apart. Accessories will add to the compliments"
Multi-Color Flourishing In Florals Top,Green floral printed rayon top. Overlapping v neckline with a belt on the waist for style. Three fourth puff sleeves with ruching on the side and tie up on sleeve hem.
Blue Pure Linen Dress With Hand Emroidery,Pure Linen with thread hand embroidery
Bespoke by Narendra kumar Navy Blue High Slit Gown,"A timeless and versatile take on evening dressing, this dark blue gown features a plunging neckline and thigh high-slit skirt which adds a feminine touch to the silhouette. Team this chic style with heels, a clutch and delicate jewellery."
Riyaa Floral Top With Tie-Up Belt (Set of 2),"Present an allure of elegance with this abutilon print kimono top by Payal Singhal. Crafted in georgette and velvet, the pack comes with a belt to complete the ensemble. Style it with statement jewellery and embellished footwear to ace the outfit."
Navy Blue Printed Top,From the premium range of Amaiva presents blue printed flared cotton top that has contrast print piping on neck and bell sleeves that makes it more stylish and it also has buttons and contrast print detailing on tassels.
Burgundy Prints All Over Me Top,Burgundy square polka polyester moss crepe top. High neck band with a belt attached at the side. Long sleeves with broad cuff band and gathers at the shoulder. Two loop buttons at the back for closure.
Blue The Cool Wave Striped Top,A blue striped cotton top with an off-shoulder silhouette and has three-fourth exaggerated layered sleeves.
Yellow Begonia Dress,"This aurora yellow printed mid length alluring dress from baise gaba has all for the perfect day out as it has free string tie up under the bust, deep v neck, modal under slip, butterfly sleeves. This dress can be wear as daywear , casual wear, regular wear ."
Olive Garden Of Eden Dress,Olive floral printed rayon dress. Fit and Flare Silhouette. Overlapping v-neckline with buttons for show. Short puff sleeves and attached frill at hemline for style. Concealed zipper on the left.
Olive The Style Breakout Dress,Olive rayon twill dress. Fit and flare silhouette. Elasticated waist with a belt and loops on the side. Pockets at center front. Centre front button down dress. Three fourth sleeves with a shirt button collar.
Ban Collar Full Sleeves Short Top With Camisole,"This red top by Label Ritu Kumar is crafted in blended fabric and features a mandarin neck, tie strings with tassel embellishments on the neckline, long bell sleeves, embroidery details and a loose fit. Buy this top online and team it with straight pants and heels to create a trendy look."
Green All About Tonight Gown,Green polyester georgette maxi dress. Polyester crepe lining inside for comfort. Fit and flare silhouette. Round neckline with back zipper for fastening and deep incut sleeves.
Wine Maroon Solid A-Line Viscose Top,Make a stunning style statement with this elegant maroon top from Jaipur Kurti. Team this top with a pair of boyfriend denims and block heels to complete the look.
White Logo Printed Short Sleeves Top,This elegant white t-shirt by GAP is crafted in cotton and is a must-have in your casual collection. Style this t-shirt with a pair of boyfriend denims and your regular sneakers to complete the look.
White Elegance In Sheer Lace Co-ordinates (Set of 2),"Crafted in polyester lace with a polyester knit lining, this pristine co-ord set isn't restricted to cocktail hour. It comes with a crop top featuring adjustable shoulder straps, a sweetheart neckline and a zip at the top. It also includes a pencil skirt with a concealed zipper on the left. Style with: Nude court heels and a gold clutch. The model (height 5'6"") is wearing a size XS"
Sage Green Stripes Kai Dress,Shirt dress with panelled leather
Bespoke by Narendra kumar Navy Blue Embroidered Peplum Top,"Featuring a tube silhouette, this Bespoke Peplum Top is crafted from pure silk in blush with delicate hand embroidery. Wear yours with everything from pared-back denim to a party-ready leather skirt."
Premium Rose Gold Solid Shrug,This stylish Shrug from Idalia will take your confident to next level. Pair it up with leggings or pants for a chic yet traditional look.
KAZO Multi-Color Button Detailed Stripe Top,"This multi-colour stripes top from Kazo will be a perfect addition to your western wear collection. Featuring a V-neck and short sleeves, style this top with a pair of jeggings and flats to complete the look. Top only."
Green Elsie Green Top,V-neck front open shirt top in fine Hemp fabric with piping detail
Navy Blue Walter Selvedge Top,"This navy blue solid top from Payal Pratap will be a great addition to your western wear collection. Featuring a boat neck and 3/4th sleeves, pair this top with jeggings, minimal accessories and casual footwear to create that go-to look."
Black Dark Night Jumpsuit,Jumpsuit with a straight shirt style shrug with embellishment
Pink High On Style Top,Pink polyester crepe top. Sleeveless deep incut shoulders. Gather detailing on the neckline with tie up at the back. Chic & classy take it to work or to a casual brunch depending on your mood this top is high on style & its versatility quotient. Accessorize with: take this look from desk to dinner by pairing it with either a pair of high waist pants or a pencil skirt and block heels!
Navy Blue Spotted In Polka Wrap Dress,Blue polka printed rayon wrap style dress. Short sleeves with an overlapping wrap style v-neckline. Concealed zipper on the left and a thin fabric belt for style. Open overlapping waistline with ruffles on the waist. Polka dots are a timeless fashion trend they can go from wearing to work to a day out with friends and even for dressing up on dates!. Accessorize with: t-strap flats and a cute crossbody bag will complete this casual chic look!
Powder Pink Sunrise Sequin Dress,Beautifully embellished dusty pink dress with scores of sequins and bugle beads. This dress looks great on its own and does not need any accessory to complete it. Pair it with nude heels for a complete look
Bespoke by Narendra kumar Navy Blue Embroidered Peplum Top With Skirt (Set of 2),"Featuring a tube silhouette, this Bespoke Peplum Top and high waisted skirt is crafted from pure silk in blush with delicate hand embroidery. The skirt in navy blue features subtle front pleats and a split hemline adding contemporary details to the mix.Wear yours with everything from pared-back denim to a party-ready leather skirt."
Beige Floral Crop Top,"This beige top by Mish is crafted in polyester and features a V- neck with button placket, short sleeves, knot tie-up details on the front and a regular fit. Style this top with jeans to complete the look. Buy this top online."
Black Stylish Solid Casual Hooded Sweatshirt,"Freshen up your winter wardrobe with this sweatshirt for women from Campus Sutra. This sweatshirt is made of 100% cotton, the cotton fabric of sweatshirt spells pure comfort and warmth. Fetch a casual and cool look for yourself by teaming it with a pair of jeans and sneakers."
