name,Description
Olive Polka Knotted Top,"This grey polka dot print top by Faballey is crafted in polyester and features a V-neck,short sleeves and tie up details on the waist and a regular fit.Buy this top online an pair it with jeans and heels to complete the look."
Black Solid V-Neck T-Shirt Dress,"This black dress by GAP is crafted in cotton and makes the perfect pick to don for daytime events and occasions. Style this stunning dress with a pair of strappy heels, pint-sized earrings and a chic handbag to complete the look."
Blue Drama In Denim Dress,Blue denim dress. Fit and flare silhouette. Ruffled shoulder straps with a curved square neckline. Centre front buttons for fastening and ease.
White Patterned Eyelet Apron Maxi Dress,"Elevate your weekend line-up with this eyelet apron dress from GAP. Woven from smooth cotton in a maxi silhouette, this fully lined piece features adjustable shoulder straps, buttoned closure at front and an elasticized waist with inner drawcord ties . Team it with simple accessories and tan brogues."
Red Edging Towards Style Dress,"Add an extra dose of style to your casual wardrobe with this red one-shoulder dress from Twenty Dresses. Style With: A pair of gold heels, a gold clutch and statement earrings will complete this gorgeous look!"
KAZO Teal Sleeveless Bodycon Jumpsuit With Tie-Up At Waist,"This teal solid jumpsuit from Kazo will be a perfect addition to your western wear collection. Featuring a round neck and sleeveless design, pair this jumpsuit with minimal accessories and flats to complete the look."
Teal Moonchild Top,Easy fit top with pleat and ruffle details
Navy Blue Sequins Yoke Top,This sequin yoke top with full sleeves is great for an evening out.
Black Let The Stripes Talk Co-ordinates,Black stripes polyester twill crepe pant co-ord set. Strappy crop top. Side zipper for top closure. Culotte pants. Side zipper with back elastic for pant closure.
White Solid Dress,Cover Story Solid White Women Dress
Melek Floral Jacket,Present an allure of elegance with this abutilon print velvet jacket by Payal Singhal. Style it with statement jewellery and embellished footwear to ace the outfit. Jacket only.
Blue Collins Short Jacket,"This blue checks jacket from Payal Pratap will be a great addition to your western wear collection. Featuring a V-neck and 3/4th sleeves, pair this jacket with a top/ shirt, trousers and heels to create that go-to look."
Pink Halter Neck Pleated Maxi Dress,A good maxi dress can save the day or the night. This rusty rose maxi dress comes with a halter neck accentuated with embellishments. Style Tip : Pair this with some stacked bracelets and midi rings.
SAMSHEK Mustard organza ruffle jumpsuit,A mustard jumpsuit with square neckline and ruffles on shoulders <br><br>Color: Mustard <br>Length: Ankle Length<br>Fit: Fitted <br>Fabric: Moss Crepe <br>Fabric Composition: 100% Polyester <br>Style: Evening
Afrika Printed Bomber Jacket With Pants (Set of 2),"Wear this ikat love bomber jacket by Payal Singhal to make a style statement. Crafted in embroidered velvet, it comes with a pant. Style it with statement jewellery and embellished footwear to ace the outfit."
Indigo Savanna Denim Jacket & Pant (Set of 2),Relax fit Jacket and pant set in natural indigo dyed Handloom Cotton khadi Denim with hand block printed fabric details. Fastened with natural coconut buttons and cotton drawstring at the waist that lets you adjust the fit
Navy Blue Cutting Up The Choker Jumpsuit,Inspire chic finesse in your line-up with this navy blue jumpsuit from Twenty Dresses. Style With: A pair of nude block heels and a chic sling bag will complete this stunning look!
Rayon Jaal Print Dress,Round Neck Dress Having Three Quarter Designer Sleeves With Button Detailing
Handloom Cotton Blue And White Check Shift Dress With Balloon Sleeves,Fabnest womens handloom cotton blue and white check shift dress with balloon sleeves
Navy Blue Geometric A-Line Rayon Top,"Featuring embroidery details, this navy blue top from Jaipur Kurti is perfect to don for casual occasions and events. Style this top with a pair black leggings and high heels to complete the look."
Band Collar Full Sleeves Green Printed Tunic,"This green printed tunic is crafted in viscose and features a banded collar neck, long sleeves with buttoned cuffs, a front buttons placket and a regular fit. Style this tunic with a pair of white trousers and high heels to complete the look."
Torqadorn Rust Colour Block Linen Poncho,"Meet your perfect accompaniment for those chilly office & theatre indoors, this cool linen colour block poncho comes to your rescue in style. Touting a handkerchief silhouette with a fabric belt for an accentuated waist, you slide in & out this wonder with ease."
Maroon High Neck Dress,"This maroon dress is crafted in cotton and features a high neck, 3/4th sleeves, a side slit and a slim fit. Style this dress with a pair of high heels and a chic clutch to complete the look."
Rust Stripes Tacey Jumpsuit,A unique de-constructed jumpsuit inspired by structural ambiguity. Tacey jumpsuit is constructed through multiple mocks and trials to achieve a bespoke body fit and a promising silhouette.
Purple The Summer Love Top,Purple polyester crepe top. Round neckline with short sleeves. Puff sleeves with inverted box pleat detailing. Keyhole in the front. Hook & eye for fastening & ease.
Torqadorn Maroon Satin Formal Shirt,"When you want a work wardrobe that’s subtle, stylish, and a bit romantic, make this wine shirt your business. Whether flavouring your coffee, taking that project lead or simply heading out with the girls for after-office drinks, you do so in style with Torqadorn's classic tailored shirt in iridescent silk satin that can be styled multiple ways; button down for a chic work-wear ensemble or tie-up to dazzle your evening look"
Mustard Snuggle Me In Crop Top,Mustard polyester crepe puff sleeve crop top. Wide square neckline with elastic on shoulders. Short puff sleeves with elastic at sleeve hem. Smocked detailing on the front and back.
White Printed Logo Classic Tee,GAP's t-shirt features a cool logo graphic at front that adds a cool flair to this style. It's made from uber-soft cotton jersey and finished with a crew neck and short sleeves. Slip yours on over cuffed shorts for a day in the sun.
Devi White Swing Dress,"This white dress from Gulaal is crafted in a mix blend of cotton and satin and features a boat neck ,3/4th sleeves with real mirror and golden zari embroidery and side seam pockets.Buy this dress online and style it with silver choker and a nose pin for a festive ready look.<br><br><br> <br>"
White Solid Calico Top With Skirt (Set of 2),Twisted jacket and skirt set
Navy Blue Striped Shirt,<br>This blue striped shirt from Vero Moda is crafted in polyester and features a mandarin neck with button placket and short sleeves. Buy this shirt online and style it with black flared trousers for office ready look.<br><br>
Cotton Flex Black Overlap Panel Jumpsuit,"This black jumpsuit by Fabnest is crafted in cotton and features a V-neck, 3/4th sleeves, a wrap style with a side tie-up detail and a regular fit. Style this jumpsuit with a pair of high heels and statement accessories to complete the look. Buy this jumpsuit online."
Bespoke by Narendra kumar Black Fully Embroidered Jacket,The hand-embroidered jacket is tailored to a slim-fit silhouette and fastens at the front with a single button. This piece is crafted using a sild fabrication and is fully lined. Wear it with the matching trousers and a silk blouse for an on-trend spring look.
Blue Piping Blazer,"Stylised Women Coat Or Blazer from the House of Campus Sutra. Feature: Lightweight, Smooth Fabric, Comfort Fit, two welt pockets on the front"
Black Metallic Logo Zip Hoodie,"GAP's cosy sweatshirt is knitted with black threads to create a unique pattern. It is cut for a loose fit and features drawcords at hoodie neckline, metallic embellishment at chest, long sleeves and a rib knit banded hemline. Wear yours over a tank when the temperature drops."
Dohyenne Black Asymmetric Cocktail Dress,Dohyenne Asymmetric multi Layered Cocktail Dress
Green String Me Up Floral Top,Green floral printed rayon crop top. V neckline with ruching at the center front and tie up at the waist. Three fourth balloon sleeves with elastic at the sleeve hem.
Peach Semi-Fit Ballerina Gown,Gown with embellishments
Black All The Way Jogger Jumpsuit,Black rayon twill jumpsuit. V neckline with short sleeves. Elasticated waist for comfort & style. Comfort fit with jogger style bottom silhouette. Center front button placket for fastening and ease.
Green Connie Soft Midi Dress,"Ideal for weddings and daytime events, our soft midi dress arrives in mint with an all-over blossom print. Wear yours with white heels and pearl jewellery.<br>"
Brown You Ruffle Me Up Top,"Add an extra dose of style to your casual wardrobe with this elegant brown top from Twenty Dresses. Style With: A pair of white denims, a cute pair of block heels and a sling bag will complete your look!"
Round Neck 3/4 Sleeves Green Printed Short Dress,"This green floral printed dress is crafted in polyester and features a round keyhole neck with button fastening, 3/4th sleeves, pleat details and a regular fit. Style this dress with a pair of high heels and statement accessories to complete the look."
Blue In The Cuteness Crop Top,Blue Striped Cotton Crop Top. Square Neck with ruffles extending to the front yoke with buttoned front detailing for style. Ruffled at hem.
Black Laced In Me Jumpsuit,Black rayon with lace sleeves jumpsuit. Off shoulder elasticated neckline with short sleeves. Elasticated waist for ease and comfort. Flared bottom silhouette.
Rust Dots Of Color Jumpsuit,Rust polka printed polyester crepe jumpsuit. Polyester knit lining inside for comfort. V neckline with incut sleeves. Smocked waistline with straight bottom silhouette. Keyhole button at the back for ease and comfort.
Maroon Double Placket Crepe Shirt Dress,"This maroon shirt dress is crafted in polyester and features a mandarin collar neck, long sleeves, a concealed front buttons placket, a curved hemline and a regular fit. Style this dress with a pair of black boots and statement earrings to attain an alluring look."
Beige Solid Top,"This beige stretchable top by Cover Story is crafted in nylon and features a high neck, a sleeveless design and a regular fit. Style this top with a pair of skinny jeans and high heels to make a statement. Buy this top online."
Multi-Color Living On The Line Stripe Jumpsuit,A multi-colored striped halter neck jumpsuit with deep incut strap and a elasticated waistline. It has a tie-up at the back neck for fastening and ease.
Mustard Crew Neck Solid Cardigan,"Get snuggly in this mustard cardigan by Aeropostale cut from blended fabric to keep you at ease. It has a crew neck and long sleeves with ribbed hems. Slip into this piece, paired with jeans and sneakers to step out in style this season."
Grey Cluster Crop Top Set (Set of 2),Crop Set with embellishments
Indigo Guisley Trench Coat,Double breasted trench coat in natural indigo dyed handloom khadi denim fastened with natural coconut button and a drawstring waist that lets you adjust the fit
White Rayon Dress,"This stylish floral print kurta from janasya is made of rayon and comes in an attractive white color. It features sleeveless,keyhole neck,gown and it is long kurta that is suitable for casual occasions. Team it with matching leggings for a chic look."
White Brohden Broderie Top,"Cut from a breathable cotton broderie fabric, this white top is made for sunny days. Style yours with pastel linen culottes and heeled sandals to complete the look."
Red Ruffles Of The Night Dress,"This stunning tulip hemmed dress is created in polyester knit, it features broad shoulder straps, a wide square neckline, an overlapping waistline with ruffles on the hem for style and a concealed zipper on the back for closure. Style With: Your favourite pair of stilettos and a box clutch will have you ready for the night ahead!"
Black Paula Solid Top,"This black top by Vero Moda is crafted in polyester and features a round neck, short sleeves, lace yoke and a regular fit. Style this top with a pair of denim jeans and high heels to complete the look."
Casual White Viscose Sweatshirt,"This white striped sweatshirt from ONLY is crafted in viscose and features a round neck, long sleeves and regular fit. Buy this sweatshirt online and style it with jeans and heels to complete the look."
Multi-Color Striped Mini Dress,"This multi coloured short dress by Mish is crafted in polyester and features a boat neck, short sleeves, self fabricated belt, striped details and a regular fit. Style this dress with dangler earrings and heels to complete the look. Buy this dress online."
Green Stripped Fit & Flare Dress,"An amazing range of women Dress in soft and solid colours that looks perfect for regular wear. With beautiful designs and patterns, these apparels are very stylish and comfortable too. Get rid of the 'regular' look this season wearing this dress"
Blooming In Blue Midi Dress,Blue floral printed sheath dress. Tie up shoulder straps with a ruffled sweetheart neckline. Smocking at the back yoke and concealed centre back zipper for fastening and ease. Gathered tier at the hemline for style. Floral midi dresses are back with a refreshing vibe for the season. Your vacation wardrobe is surely in for a easy-breezy silhouette that is a mix of both comfort & style. Accessorize with: block heels a crossbody bag and minimal jewellery will have you brunch ready in no time!
Black Polka On My Mind Monochrome Playsuit,Black polka dot printed rayon playsuit. V neckline with mock buttons at front for style. Flared sleeves with slit for style. Concealed back zipper.
Black Wrap Up The Night Top,Black polyester crepe top. Wrap style top with lapel on the neckline. Button closure on the lapel. Long sleeves with gathers at the shoulder and elasticated cuff.
KAZO Dark Green Petal Shirt,"This green embroidered shirt from Kazo will be a perfect addition to your western wear collection. Featuring a collar neck and short sleeves, style this shirt with a pair of trousers and block heels to complete the look. Shirt only."
Pink Turn Up The Pleat Jumpsuit,Pink pleated velvet jumpsuit. Sleeveless with a v neckline. Waist cut with a waist band for detailing. Straight legged bottoms. Concealed centre back zipper for fastening and ease.
Torqadorn Olive Pleated Torso Jumpsuit,"Perfectly prepare for a dreamy rendezvous and in the stunning style of this green jumpsuit from Torqadorn. Crafted from satin georgette, it boasts of a pleated torso overlap with flared bottoms, a racer back and a fabric belt with rivets to complete the look. This number ushers in the evening with effortless finesse."
Navy Blue Flirty Top,Easy fit open back top with balloon sleeves and keyhole detail in front and shirring at the waist
Green Short Sleeves Solid Top,"Make a stunning style statement with this elegant green top from GAP. Crafted in cotton, style this top with a pair of girlfriend denims and high heels to complete the ensemble."
Alex Velvet Burnout Midi Wrap Dress,This slinky black midi wrap dress is cut from a sheer fabric embellished with textured metallic thread and velvet flowers. It's a glamorous choice for after-dark events and promises to go perfectly with your favourite black heels.
Maroon Printed Dress,This dress is a perfect combination of comfort and style. Pair it with heels and fine accessories to complete the look.
Coral Nupi Midi Dress,Midi dress with high neck and tie straps
Teal Solid Coat Style Wrap Jumpsuit,"Featuring a coat style wrap detail on the front, this teal jumpsuit from The Silhouette Store makes an elegant addition to your casual wardrobe. Style this jumpsuit with a pair of high heels and super-sized earrings to complete the look."
KAZO White Mickey Print With Sequin Shirt,"This white printed shirt from Kazo will be a perfect addition to your western wear collection. Featuring a collar neck and long sleeves, style this shirt with a pair of trousers and block heels to complete the look. Shirt only."
Collar Neck 3/4th Sleeves Short Top,Collar Neck 3/4 Sleeves Short Top
Olive Flatter Me Right Dress,Olive polyester crepe dress. Sheath silhouette. Half rolled up sleeves. Lapel collar with an overlapping v neckline. Button detail on the left front side. Concealed zipper on the left for fastening and ease.
Red Checks Shoulder Strap Jumpsuit,"This red and blue jumpsuit by ONLY is crafted in cotton, sleeveless and features a V neck, check patterns all over, shoulder straps and a zip closure at the back. Pair this jumpsuit with flats and fine accessories to complete the look. Buy this jumpsuit online."
Green Gables Pullover,"This green pullover by Only is crafted in viscose and features a round neck, long sleeves, dropped shoulders and a regular fit. Buy this pullover online and style it with a pair of skinny jeans and casual flats to complete the look."
Round Neck 3/4th Sleeves Long Dress,Round Neck Full Sleeves Long Dress
Grey Short Sleeves Printed Top,This elegant blue t-shirt by GAP is crafted in cotton and is a must-have in your casual collection. Style this t-shirt with a pair of boyfriend denims and your regular sneakers to complete the look.
Red Raving In Ruffles Jumpsuit,Maroon polyester knit jumpsuit. Sleeveless with a round neckline. Ruffles at the neckline and armhole for styling. Fitted body and straight leg silhouette. Center back zipper for fastening and ease.
Grey Printed Logo Classic Tee,GAP's t-shirt features a cool logo graphic at front that adds a cool flair to this style. It's made from uber-soft cotton jersey and finished with a crew neck and short sleeves. Slip yours on over cuffed shorts for a day in the sun.
Black Solid Maxi Dress,"This black maxi dress by Mish is crafted in polyester and features a V-neck, ruffled sleeves with ruffle details, embroidered belt on the front and a regular fit. Style this maxi dress with all silver earrings and clutch for a party ready look. Buy this dress online."
Torqadorn Silver Blue Formal Shirt,"When you want a work wardrobe that’s subtle, stylish, and a bit romantic, make this silver-blue shirt your business. Whether flavouring your coffee, taking that project lead or simply heading out with the girls for after-office drinks, you do so in style with Torqadorn's classic tailored shirt in iridescent silk satin that can be styled multiple ways; button down for a chic work-wear ensemble or tie-up to dazzle your evening look"
Black Dhoti Style Jumpsuit,"If You Are Looking For A Unique Pattern In Your Wardrobe And A Highly Stylised Kurta Then Divena Has The Answer For You. Presenting Divenas Unique Dhoti Style Kurta With Rising Side Slits And Tussles On Both Sides And A Closed Neckline And Three Fourth Sleeves, Is Perfect For Any Casual Day Outing Or Evening Party Wear. Pair It Up With Mojri , Metallic Jewellery For That Ravishing Look"
Cotton Linen Comfort Pleated Grey Top,Stylish designs made in the highest quality cotton linen is the summer respite you seek
Rust Collar Neck Printed Jumpsuit,"Make a bold fashion statement wearing this pair of jodhpuri jumpsuit by desi weaves. With flawless fit and finish, theis comfortable jumpsuit will make your casual everyday look trendy and stylish."
Off White Crop Me In Stripes Top,Off white vertical stripe printed cotton crop top. Wide v neckline with elasticated gathers on the bust. Horizontal stripes on the center panel and princess cut at the back. Three fourth puff sleeves. Concealed side zipper for fastening and ease.
Rust You Ruffle Me Up Top,Rust polyester crepe top. Round neckline with button with keyhole in the back for fastening and ease. Sleeveless with a ruffled layer on the neckline for style.
Red Dont Dull My Shine Jumpsuit,"Crafted in satin with a polyster knit lining, you won't do away with this classic jumpsuit any time soon. It features a cowl neckline, adjustable shoulder straps, a flared bottom and a concealed zipper at the back. Style with: Gold stilettos, hoops and chain crossbody bag.The model (height 5'6"") is wearing a size XS"
Navy Blue Play With Polka Midi Dress,Navy blue polka printed rayon tiered midi dress. Adjustable shoulder straps with a square neckline. Smocking detail on the back yoke and drawstring at the waist for style and comfort. Fit and flare silhouette. Three gathered tiers from the waist to hemline. Polka dots are a timeless fashion trend they can go from wearing to work to a day out with friends and even for dressing up on dates!. Accessorize with: t-strap flats and a cute crossbody bag will complete this casual chic look!
Teal Frills Of Fun Crop Top,Teal polyester crepe crop top. Wide square neckline with elastic on shoulders. Frill detailing at neckline and sleeve hem. Short puff sleeves with elastic at frill attachment. Smocked detailing on the front and back.
Black You Got The Look Maxi Dress,"Featuring a halter neckline, this black maxi dress from Twenty Dresses is perfect to don for evening parties and events. Style With: A pair of strappy open-toe stilettos, subtle accessories & a hint of dazzle with a clutch to complete the look!"
Pink Linen Cap Sleeve T-Shirt,"Made from light linen jersey knit, this soft top from GAP is a must-have for warm summer days. It is detailed with a scoop neckline, cap sleeves and a curved hem. Wear yours with a cropped jeans for a stylish look."
Olive The Brightest Button Dress,Olive polyester crepe dress. Wrap style v neckline with three fourth sleeves. Button detail on the left thigh. Elasticated waist with an attached tie up belt. Ruching on the sleeve sides with tie up detailing. Fit and flare silhouette.
Multi-Color Printed Shirt,"This Kazo multi-colour polyester printed shirt has a collar neck, long sleeves and a regular fit. Pair this shirt with bell-bottom pants and heels to complete the look."
Multi-Color Textures Of Stripe Top,Multi-color vertical stripe printed cotton peplum top. V neckline with ruching at the center front and tie up at the waist. Horizontal stripe pleats at the waist for style. Puff full sleeves with elastic at the sleeve hem. Concealed side zipper for fastening and ease. Cotton voile lining inside for comfort.
Pink The Boss Bebe Top,Pink polyester satin formal top. High neck collar detail. Puffy sleeves with Broad cuff for style. Keyhole at Back.
Pink Ruffles On The Line Dress,Pink floral printed polyester chiffon maxi dress. Polyester knit lining inside for comfort. Asymmetrical hemline with ruffles on it and an overlapping waistline. V neckline with sheer full sleeves. Concealed zipper on the left side for fastening and ease.
Navy Blue Afghani Asterix Cotton Hand Embroidered Top,A Kaftaan style top for your summer outings?! Here is an organic bold deep blue shade embroidered top with the Andromeda constellation pattern; in the pervasive cotton fabric. It’s a light weight and no-fuss summer top that gives the garment breathing space while amplifying the style and cool quotient for you at casual outings and friendly meetings.
White Solid/Printed Statement Sleeves Hi-Low Top,Solid draped/statement sleeves hi-low top with button detailing. Slit sleeves are very trendy yet comfortable and wearable. Top is of the latest design. Length of the top is regular length and not cropped. Golden buttons at the cuff add to the style quotient. It can work with jeans or high waist pants or palazzos. Wrinkle free fabric makes it travel friendly. Its quick drying fabric helps avoid sweat patches.
Black Cross Over To The Other Side Jumpsuit,Black Polyester Knit Jumpsuit. Halter Criss Cross style neckline. Center Back Zipper & hook at the back for fastening & ease. Straight leg bottoms.
Black & Olive Contrast Detail Shirt,"Crafted in polycotton, this black shirt features a shirt collar neck, 3/4th sleeves, a front buttons placket and a regular fit. Style this shirt with a pair of skinny denims and high heels to complete the look."
Blue Floral Print Jumpsuit,"Channel some retro vibes with this jumpsuit. Featuring a floral print fabric, a ruffle neckline with a self fastening and a wide leg bottom, team it with some open flats for a special occasion worthy look. Please note: This piece is handmade with love and care by various artisans and therefore slight differences of design and colour may occur from piece-to-piece which allows for a signature one-of-a-kind aesthetic."
Black Key Hole Back Floral Maxi Dress,Peplum Black Key Hole Back Floral Maxi Dress
Navy Blue Self Printed Fit & Flare Dress,"An amazing range of women Dress in soft and solid colours that looks perfect for regular wear. With beautiful designs and patterns, these apparels are very stylish and comfortable too. Get rid of the 'regular' look this season wearing this dress"
Green Floral In The Cuteness Crop Top,Green floral printed rayon crop top. Shoulder straps with ruffle detailing extending till the waist. Centre front button placket for show. Gathered waistline for style. A cute & a trendy update to your wardrobe is what you need to up your fashion game. Accessorize with: denim short or high waist pants to take you from a day to dusk look!
Blue Wrap Me In Flowers Dress,Blue floral printed wrap rayon dress. Fit and flare silhouette. Wrap style with tie-up at waist. Puff sleeve detail.
Black Ruched In Style Crop Top With Skirt (Set of 2),"Created in black polyester shimmer knit, this set features a crop top and a bodycon skirt, the top has a v-neckline, three fourth puff sleeves with elasticated hem, a waist yoke and a centre back zipper, the bodycon skirt features ruching at the front for style, a thigh high slit and a concealed side zipper. Style With : a pair of shimmer court heels, a box clutch and statement accessories to have you party ready!"
